workflows/check/OUTPUT/NEON_CH4_gradient_flux_sign_audit_overall.csv

Approach,tower_order,n,prop_FG_opposite_dConc,prop_FG_same_as_dConc,median_FG,median_dConc,prop_positive_FG,prop_negative_dConc
AE,A above B,119951,1,0,-1.1851308623092291e-4,0.00261495441278381,0.46406449300130886,0.46406449300130886
MBR,A above B,103165,0.7830465758736005,0.21695342412639945,9.313910656583384e-4,0.0022008804708222307,0.5378471380797751,0.4914166626278292
WP,A above B,118222,1,0,-0.00360600870932293,0.0025882099647057677,0.46588621407183095,0.46588621407183095

workflows/check/OUTPUT/NEON_CH4_gradient_flux_sign_audit.md

## Overall Sign Relationship

- AE / A above B: n = 119951, opposite sign = 100%, same sign = 0%, median FG = -0.000119, median dConc = 0.00261
- MBR / A above B: n = 103165, opposite sign = 78.3%, same sign = 21.7%, median FG = 0.000931, median dConc = 0.0022
- WP / A above B: n = 118222, opposite sign = 100%, same sign = 0%, median FG = -0.00361, median dConc = 0.00259